Port,Description
0,"In programming APIs (not in communication between hosts), requests a system-allocated (dynamic) port"
1,"TCP Port Service Multiplexer (TCPMUX). Historic. Both TCP and UDP have been assigned to TCPMUX by IANA, but by design only TCP is specified."
5,"Remote Job Entry was historically using socket 5 in its old socket form, while MIB PIM has identified it as TCP/5 and IANA has assigned both TCP and UDP 5 to it."
7,Echo Protocol
9,Discard Protocol
9,Wake-on-LAN
11,Active Users (systat service)
13,Daytime Protocol
15,Previously netstat service
17,Quote of the Day (QOTD)
18,Message Send Protocol
19,Character Generator Protocol (CHARGEN)
20,File Transfer Protocol (FTP) data transfer
21,File Transfer Protocol (FTP) control (command)
22,"Secure Shell (SSH), secure logins, file transfers (scp, sftp) and port forwarding"
23,Telnet protocol-unencrypted text communications
25,"Simple Mail Transfer Protocol (SMTP), used for email routing between mail servers"
37,Time Protocol
38,Route Access Protocol (RAP)
39,Resource Location Protocol (RLP)-used for determining the location of higher level services from hosts on a network
42,Host Name Server Protocol
43,WHOIS protocol
49,"TACACS Login Host protocol. TACACS+, still in draft which is an improved but dinstinct version of TACACS, only uses TCP 49."
50,Remote Mail Checking Protocol
51,"Historically used for Interface Message Processor logical address management, entry has been removed by IANA on 2013-05-25"
52,"Xerox Network Systems (XNS) Time Protocol. Despite this port being assigned by IANA, the service is meant to work on SPP (ancestor of IPX/SPX), instead of TCP/IP."
53,Domain Name System (DNS)
54,"Xerox Network Systems (XNS) Clearinghouse (Name Server). Despite this port being assigned by IANA, the service is meant to work on SPP (ancestor of IPX/SPX), instead of TCP/IP."
56,"Xerox Network Systems (XNS) Authentication Protocol. Despite this port being assigned by IANA, the service is meant to work on SPP (ancestor of IPX/SPX), instead of TCP/IP."
57,Any private terminal access
58,"Xerox Network Systems (XNS) Mail. Despite this port being assigned by IANA, the service is meant to work on SPP (ancestor of IPX/SPX), instead of TCP/IP."
61,"Historically assigned to the NIFTP-Based Mail protocol, but was never documented in the related IEN. The port number entry was removed from IANA's registry on 2017-05-18."
67,Bootstrap Protocol (BOOTP) server; also used by Dynamic Host Configuration Protocol (DHCP)
68,Bootstrap Protocol (BOOTP) client; also used by Dynamic Host Configuration Protocol (DHCP)
69,Trivial File Transfer Protocol (TFTP)
70,Gopher protocol
71-74,NETRJS protocol
75,Any private dial out service
77,Any private Remote job entry
79,Finger protocol
80,Hypertext Transfer Protocol (HTTP)
80,"Quick UDP Internet Connections (QUIC), a transport protocol over UDP (still in draft as of July 2018), using stream multiplexing, encryption by default with TLS, and currently supporting HTTP/2."
81,TorPark onion routing
82,TorPark control
87,Any private terminal link
88,Kerberos authentication system
90,dnsix (DoD Network Security for Information Exchange) Security Attribute Token Map
90,PointCast (dotcom)
99,WIP message protocol
101,NIC host name
102,ISO Transport Service Access Point (TSAP) Class 0 protocol;
104,Digital Imaging and Communications in Medicine (DICOM; also port 11112)
105,CCSO Nameserver
107,Remote User Telnet Service (RTelnet)
108,IBM Systems Network Architecture (SNA) gateway access server
109,"Post Office Protocol, version 2 (POP2)"
110,"Post Office Protocol, version 3 (POP3)"
111,"Open Network Computing Remote Procedure Call (ONC RPC, sometimes referred to as Sun RPC)"
113,"Ident, authentication service/identification protocol, used by IRC servers to identify users"
113,"Authentication Service (auth), the predecessor to identification protocol. Used to determine a user's identity of a particular TCP connection."
115,Simple File Transfer Protocol
117,UUCP Mapping Project (path service)
118,Structured Query Language (SQL) Services
119,"Network News Transfer Protocol (NNTP), retrieval of newsgroup messages"
123,"Network Time Protocol (NTP), used for time synchronization"
126,"Formerly Unisys Unitary Login, renamed by Unisys to NXEdit. Used by Unisys Programmer's Workbench for Clearpath MCP, an IDE for Unisys MCP software development"
135,DCE endpoint resolution
135,"Microsoft EPMAP (End Point Mapper), also known as DCE/RPC Locator service, used to remotely manage services including DHCP server, DNS server and WINS. Also used by DCOM"
137,"NetBIOS Name Service, used for name registration and resolution"
138,NetBIOS Datagram Service
139,NetBIOS Session Service
143,"Internet Message Access Protocol (IMAP), management of electronic mail messages on a server"
152,Background File Transfer Program (BFTP)
153,"Simple Gateway Monitoring Protocol (SGMP), a protocol for remote inspection and alteration of gateway management information"
156,Structured Query Language (SQL) Service
158,"Distributed Mail System Protocol (DMSP, sometimes referred to as Pcmail)"
161,Simple Network Management Protocol (SNMP)
162,Simple Network Management Protocol Trap (SNMPTRAP)
170,Print server
177,"X Display Manager Control Protocol (XDMCP), used for remote logins to an X Display Manager server"
179,"Border Gateway Protocol (BGP), used to exchange routing and reachability information among autonomous systems (AS) on the Internet"
194,Internet Relay Chat (IRC)
199,SNMP multiplexing protocol (SMUX)
201,AppleTalk Routing Maintenance
209,Quick Mail Transfer Protocol
210,ANSI Z39.50
213,Internetwork Packet Exchange (IPX)
218,Message posting protocol (MPP)
220,"Internet Message Access Protocol (IMAP), version 3"
259,Efficient Short Remote Operations (ESRO)
262,Arcisdms
264,Border Gateway Multicast Protocol (BGMP)
280,http-mgmt
300,ThinLinc Web Access
308,Novastor Online Backup
311,Mac OS X Server Admin (officially AppleShare IP Web administration)
318,PKIX Time Stamp Protocol (TSP)
319,Precision Time Protocol (PTP) event messages
320,Precision Time Protocol (PTP) general messages
350,Mapping of Airline Traffic over Internet Protocol (MATIP) type A
351,MATIP type B
356,cloanto-net-1 (used by Cloanto Amiga Explorer and VMs)
366,On-Demand Mail Relay (ODMR)
369,Rpc2portmap
370,"codaauth2, Coda authentication server"
370,"securecast1, outgoing packets to NAI's SecureCast serversAs of  2000"
371,ClearCase albd
383,HP data alarm manager
384,A Remote Network Server System
387,AURP (AppleTalk Update-based Routing Protocol)
389,Lightweight Directory Access Protocol (LDAP)
399,Digital Equipment Corporation DECnet (Phase V+) over TCP/IP
401,Uninterruptible power supply (UPS)
427,Service Location Protocol (SLP)
433,"NNSP, part of Network News Transfer Protocol"
434,Mobile IP Agent (RFC 5944)
443,Hypertext Transfer Protocol over TLS/SSL (HTTPS)
443,"Quick UDP Internet Connections (QUIC), a transport protocol over UDP (still in draft as of July 2018), using stream multiplexing, encryption by default with TLS, and currently supporting HTTP/2."
444,"Simple Network Paging Protocol (SNPP), RFC 1568"
445,"Microsoft-DS (Directory Services) Active Directory, Windows shares"
445,Microsoft-DS (Directory Services) SMB file sharing
464,Kerberos Change/Set password
465,URL Rendezvous Directory for SSM (Cisco protocol)
465,Authenticated SMTP over TLS/SSL (SMTPS)
475,"tcpnethaspsrv, Aladdin Knowledge Systems Hasp services"
491,GO-Global remote access and application publishing software
497,Retrospect
500,Internet Security Association and Key Management Protocol (ISAKMP) / Internet Key Exchange (IKE)
502,Modbus Protocol
504,"Citadel, multiservice protocol for dedicated clients for the Citadel groupware system"
510,"FirstClass Protocol (FCP), used by FirstClass client/server groupware system"
512,"Rexec, Remote Process Execution"
512,"comsat, together with biff"
513,rlogin
513,Who
514,"Remote Shell, used to execute non-interactive commands on a remote system (Remote Shell, rsh, remsh)"
514,"Syslog, used for system logging"
515,"Line Printer Daemon (LPD), print service"
517,Talk
518,NTalk
520,"efs, extended file name server"
520,Routing Information Protocol (RIP)
521,Routing Information Protocol Next Generation (RIPng)
524,"NetWare Core Protocol (NCP) is used for a variety things such as access to primary NetWare server resources, Time Synchronization, etc."
525,"Timed, Timeserver"
530,Remote procedure call (RPC)
532,netnews
533,"netwall, For Emergency Broadcasts"
540,Unix-to-Unix Copy Protocol (UUCP)
542,commerce (Commerce Applications)
543,"klogin, Kerberos login"
544,"kshell, Kerberos Remote shell"
546,DHCPv6 client
547,DHCPv6 server
548,Apple Filing Protocol (AFP) over TCP
550,"new-rwho, new-who"
554,Real Time Streaming Protocol (RTSP)
556,"Remotefs, RFS, rfs_server"
560,"rmonitor, Remote Monitor"
561,monitor
563,NNTP over TLS/SSL (NNTPS)
564,9P (Plan 9)
585,"Legacy use of Internet Message Access Protocol over TLS/SSL (IMAPS), now in use at port 993."
587,email message submission (SMTP)
591,"FileMaker 6.0 (and later) Web Sharing (HTTP Alternate, also see port 80)"
593,"HTTP RPC Ep Map, Remote procedure call over Hypertext Transfer Protocol, often used by Distributed Component Object Model services and Microsoft Exchange Server"
601,Reliable Syslog Service - used for system logging
604,"TUNNEL profile, a protocol for BEEP peers to form an application layer tunnel"
623,ASF Remote Management and Control Protocol (ASF-RMCP) & IPMI Remote Management Protocol
625,Open Directory Proxy (ODProxy)
631,Internet Printing Protocol (IPP)
631,Common Unix Printing System (CUPS) administration console (extension to IPP)
635,RLZ DBase
636,Lightweight Directory Access Protocol over TLS/SSL (LDAPS)
639,"MSDP, Multicast Source Discovery Protocol"
641,"SupportSoft Nexus Remote Command (control/listening), a proxy gateway connecting remote control traffic"
643,SANity
646,"Label Distribution Protocol (LDP), a routing protocol used in MPLS networks"
647,DHCP Failover protocol
648,Registry Registrar Protocol (RRP)
651,IEEE-MMS
653,"SupportSoft Nexus Remote Command (data), a proxy gateway connecting remote control traffic"
654,Media Management System (MMS) Media Management Protocol (MMP)
655,Tinc VPN daemon
657,"IBM RMC (Remote monitoring and Control) protocol, used by System p5 AIX Integrated Virtualization Manager (IVM) and Hardware Management Console to connect managed logical partitions (LPAR) to enable dynamic partition reconfiguration"
660,"Mac OS X Server administration, version 10.4 and earlier"
666,"Doom, first online first-person shooter"
666,"airserv-ng, aircrack-ng's server for remote-controlling wireless devices"
674,Application Configuration Access Protocol (ACAP)
688,REALM-RUSD (ApplianceWare Server Appliance Management Protocol)
690,Velneo Application Transfer Protocol (VATP)
691,MS Exchange Routing
694,Linux-HA high-availability heartbeat
695,IEEE Media Management System over SSL (IEEE-MMS-SSL)
698,Optimized Link State Routing (OLSR)
700,"Extensible Provisioning Protocol (EPP), a protocol for communication between domain name registries and registrars (RFC 5734)"
701,"Link Management Protocol (LMP), a protocol that runs between a pair of nodes and is used to manage traffic engineering (TE) links"
702,IRIS (Internet Registry Information Service) over BEEP (Blocks Extensible Exchange Protocol) (RFC 3983)
706,Secure Internet Live Conferencing (SILC)
711,Cisco Tag Distribution Protocol-being replaced by the MPLS Label Distribution Protocol
712,Topology Broadcast based on Reverse-Path Forwarding routing protocol (TBRPF; RFC 3684)
749,Kerberos (protocol) administration
750,"kerberos-iv, Kerberos version IV"
751,"kerberos_master, Kerberos authentication"
752,"passwd_server, Kerberos password (kpasswd) server"
753,Reverse Routing Header (RRH)
753,"userreg_server, Kerberos userreg server"
754,tell send
754,"krb5_prop, Kerberos v5 slave propagation"
760,"krbupdate , Kerberos registration"
782,Conserver serial-console management server
783,SpamAssassin spamd daemon
800,mdbs-daemon
808,Microsoft Net.TCP Port Sharing Service
829,Certificate Management Protocol
830,NETCONF over SSH
831,NETCONF over BEEP
832,NETCONF for SOAP over HTTPS
833,NETCONF for SOAP over BEEP
843,Adobe Flash
847,DHCP Failover protocol
848,Group Domain Of Interpretation (GDOI) protocol
853,DNS over TLS (RFC 7858)
860,iSCSI (RFC 3720)
861,OWAMP control (RFC 4656)
862,TWAMP control (RFC 5357)
873,rsync file synchronization protocol
888,"cddbp, CD DataBase (CDDB) protocol (CDDBP)"
888,IBM Endpoint Manager Remote Control
897,Brocade SMI-S RPC
898,Brocade SMI-S RPC SSL
902,VMware ESXi
903,VMware ESXi
953,BIND remote name daemon control (RNDC)
981,Remote HTTPS management for firewall devices running embedded Check Point VPN-1 software
987,"Microsoft Remote Web Workplace, a feature of Windows Small Business Server"
989,"FTPS Protocol (data), FTP over TLS/SSL"
990,"FTPS Protocol (control), FTP over TLS/SSL"
991,Netnews Administration System (NAS)
992,Telnet protocol over TLS/SSL
993,Internet Message Access Protocol over TLS/SSL (IMAPS)
994,
994,"Internet Relay Chat over TLS/SSL (IRCS). Previously assigned, but not used in common practice."
995,Post Office Protocol 3 over TLS/SSL (POP3S)
1010,ThinLinc web-based administration interface
1023,z/OS Network File System (NFS) (potentially ports 991-1023)
1027,Native IPv6 behind IPv4-to-IPv4 NAT Customer Premises Equipment (6a44)
1028,Deprecated
1029,Microsoft DCOM services
1058,"nim, IBM AIX Network Installation Manager (NIM)"
1059,"nimreg, IBM AIX Network Installation Manager (NIM)"
1080,SOCKS proxy
1085,WebObjects
1098,"rmiactivation, Java remote method invocation (RMI) activation"
1099,"rmiregistry, Java remote method invocation (RMI) registry"
1109,Reserved - IANA
1109,Kerberos Post Office Protocol (KPOP)
1119,"Battle.net chat/game protocol, used by Blizzard's games"
1167,Cisco IP SLA (Service Assurance Agent)
1194,OpenVPN
1198,The cajo project Free dynamic transparent distributed computing in Java
1214,Kazaa
1220,QuickTime Streaming Server administration
1234,Infoseek search agent
1234,VLC media player default port for UDP/RTP stream
1241,Nessus Security Scanner
1270,Microsoft System Center Operations Manager (SCOM) (formerly Microsoft Operations Manager (MOM)) agent
1293,Internet Protocol Security (IPSec)
1311,Windows RxMon.exe
1311,Dell OpenManage HTTPS
1314,Festival Speech Synthesis System server
1337,neo4j-shell
1337,WASTE Encrypted File Sharing Program
1341,Qubes (Manufacturing Execution System)
1344,Internet Content Adaptation Protocol
1352,IBM Lotus Notes/Domino (RPC) protocol
1360,Mimer SQL
1414,IBM WebSphere MQ (formerly known as MQSeries)
1417,Timbuktu Service 1 Port
1418,Timbuktu Service 2 Port
1419,Timbuktu Service 3 Port
1420,Timbuktu Service 4 Port
1431,"Reverse Gossip Transport Protocol (RGTP), used to access a General-purpose Reverse-Ordered Gossip Gathering System (GROGGS) bulletin board, such as that implemented on the Cambridge University's Phoenix system"
1433,Microsoft SQL Server database management system (MSSQL) server
1434,Microsoft SQL Server database management system (MSSQL) monitor
1492,"Sid Meier's CivNet, a multiplayer remake of the original Sid Meier's Civilization game"
1494,Citrix Independent Computing Architecture (ICA)
1500,IBM Tivoli Storage Manager server
1501,IBM Tivoli Storage Manager client scheduler
1503,Windows Live Messenger (Whiteboard and Application Sharing)
1512,Microsoft's Windows Internet Name Service (WINS)
1513,Garena game client
1521,nCUBE License Manager
1521,"Oracle database default listener, in future releases official port 2483 (TCP/IP) and 2484 (TCP/IP with SSL)"
1524,"ingreslock, ingres"
1527,"Oracle Net Services, formerly known as SQL*Net"
1527,Apache Derby Network Server
1533,IBM Sametime Virtual Places Chat
1540,1C:Enterprise server agent (ragent)  
1541,1C:Enterprise master cluster manager (rmngr) 
1542,1C:Enterprise configuration repository server 
1545,1C:Enterprise cluster administration server (RAS) 
1547,Laplink
1550,1C:Enterprise debug server 
1550,Gadu-Gadu (direct client-to-client)
1560-1591,1C:Enterprise cluster working processes 
1581,MIL STD 2045-47001 VMF
1581,IBM Tivoli Storage Manager web client
1582-1583,IBM Tivoli Storage Manager server web interface
1583,Pervasive PSQL
1589,Cisco VLAN Query Protocol (VQP)
1604,DarkComet remote administration tool (RAT)
1626,iSketch
1627,iSketch
1628,LonTalk normal
1629,LonTalk urgent
1645,Early deployment of RADIUS before RFC standardization was done using UDP port number 1645. Enabled for compatibility reasons by default on Cisco and Juniper Networks RADIUS servers. Official port is 1812. TCP port 1645 must not be used.
1646,"Old radacct port, RADIUS accounting protocol. Enabled for compatibility reasons by default on Cisco and Juniper Networks RADIUS servers. Official port is 1813. TCP port 1646 must not be used."
1666,Perforce
1677,Novell GroupWise clients in client/server access mode
1688,Microsoft Key Management Service (KMS) for Windows Activation
1701,Layer 2 Forwarding Protocol (L2F)
1701,Layer 2 Tunneling Protocol (L2TP)
1707,Windward Studios games (vdmplay)
1707,"L2TP/IPsec, for establish an initial connection"
1716,"America's Army, a massively multiplayer online game (MMO)"
1719,H.323 registration and alternate communication
1720,H.323 call signaling
1723,Point-to-Point Tunneling Protocol (PPTP)
1755,"Microsoft Media Services (MMS, ms-streaming)"
1761,Novell ZENworks
1783,"Decomissioned  Port 04/14/00, ms"
1801,Microsoft Message Queuing
1812,"RADIUS authentication protocol, radius"
1813,"RADIUS accounting protocol, radius-acct"
1863,"Microsoft Notification Protocol (MSNP), used by the Microsoft Messenger service and a number of instant messaging Messenger clients"
1880,Node-RED
1883,MQTT (formerly MQ Telemetry Transport)
1900,"Simple Service Discovery Protocol (SSDP), discovery of UPnP devices"
1935,"Macromedia Flash Communications Server MX, the precursor to Adobe Flash Media Server before Macromedia's acquisition by Adobe on December 3, 2005"
1935,"Real Time Messaging Protocol (RTMP), primarily used in Adobe Flash"
1967,Cisco IOS IP Service Level Agreements (IP SLAs) Control Protocol
1970,Netop Remote Control
1972,InterSystems Caché
1984,Big Brother
1985,Cisco Hot Standby Router Protocol (HSRP)
1998,Cisco X.25 over TCP (XOT) service
2000,Cisco Skinny Client Control Protocol (SCCP)
2010,Artemis: Spaceship Bridge Simulator
2033,Civilization IV multiplayer
2049,Network File System (NFS)
2056,Civilization IV multiplayer
2080,Autodesk NLM (FLEXlm)
2082,cPanel default
2083,Secure RADIUS Service (radsec)
2083,cPanel default SSL
2086,GNUnet
2086,WebHost Manager default
2087,WebHost Manager default SSL
2095,cPanel default web mail
2096,cPanel default SSL web mail
2100,Warzone 2100 multiplayer
2101,Networked Transport of RTCM via Internet Protocol (NTRIP)
2102,Zephyr Notification Service server
2103,Zephyr Notification Service serv-hm connection
2104,Zephyr Notification Service hostmanager
2123,GTP control messages (GTP-C)
2142,TDMoIP (TDM over IP)
2152,GTP user data messages (GTP-U)
2159,GDB remote debug port
2181,EForward-document transport system
2181,Apache ZooKeeper default client port
2195,Apple Push Notification Service
2196,"Apple Push Notification Service, feedback service"
2210,NOAAPORT Broadcast Network
2211,EMWIN
2221,ESET anti-virus updates
2222,EtherNet/IP implicit messaging for IO data
2222,DirectAdmin Access
2222-2226,ESET Remote administrator
2261,CoMotion master
2262,CoMotion backup
2266,M-Files
2302,ArmA multiplayer
2302,Halo: Combat Evolved multiplayer host
2303,ArmA multiplayer (default port for game +1)
2303,Halo: Combat Evolved multiplayer listener
2305,ArmA multiplayer (default port for game +3)
2351,AIM game LAN network port
2368,Ghost (blogging platform)
2369,Default for BMC Control-M/Server Configuration Agent
2370,"Default for BMC Control-M/Server, to allow the Control-M/Enterprise Manager to connect to the Control-M/Server"
2372,"Default for K9 Web Protection/parental controls, content filtering agent"
2375,Docker REST API (plain)
2376,Docker REST API (SSL)
2377,Docker Swarm cluster management communications
2379,CoreOS etcd client communication
2379,KGS Go Server
2380,CoreOS etcd server communication
2399,FileMaker Data Access Layer (ODBC/JDBC)
2401,CVS version control system password-based server
2404,"IEC 60870-5-104, used to send electric power telecontrol messages between two systems via directly connected data circuits"
2424,OrientDB database listening for binary client connections
2427,Media Gateway Control Protocol (MGCP) media gateway
2447,ovwdb-OpenView Network Node Manager (NNM) daemon
2480,OrientDB database listening for HTTP client connections
2483,"Oracle database listening for insecure client connections to the listener, replaces port 1521"
2484,Oracle database listening for SSL client connections to the listener
2535,Multicast Address Dynamic Client Allocation Protocol (MADCAP). All standard messages are UDP datagrams.
2541,LonTalk/IP
2546-2548,EVault data protection services
2593,Ultima Online servers
2598,Citrix Independent Computing Architecture (ICA) with Session Reliability; port 1494 without session reliability
2599,Ultima Online servers
2638,SQL Anywhere database server
2710,XBT Tracker. UDP tracker extension is considered experimental.
2727,Media Gateway Control Protocol (MGCP) media gateway controller (call agent)
2809,"corbaloc:iiop URL, per the CORBA 3.0.3 specification"
2811,"gsi ftp, per the GridFTP specification"
2827,I2P BOB Bridge
2944,Megaco text H.248
2945,Megaco binary (ASN.1) H.248
2947,"gpsd, GPS daemon"
2948,WAP push Multimedia Messaging Service (MMS)
2949,WAP push secure (MMS)
2967,Symantec System Center agent (SSC-AGENT)
3000,Cloud9 IDE server
3000,Ruby on Rails development default
3000,Meteor development default
3000,"Resilio Sync, spun from BitTorrent Sync."
3000,Distributed Interactive Simulation (DIS)
3004,iSync
3020,"Common Internet File System (CIFS). See also port 445 for Server Message Block (SMB), a dialect of CIFS."
3050,gds-db (Interbase/Firebird databases)
3052,APC PowerChute Network
3074,Xbox LIVE and Games for Windows - Live
3101,BlackBerry Enterprise Server communication protocol
3128,Squid caching web proxy
3225,Fibre Channel over IP (FCIP)
3233,WhiskerControl research control protocol
3260,iSCSI
3268,"msft-gc, Microsoft Global Catalog (LDAP service which contains data from Active Directory forests)"
3269,"msft-gc-ssl, Microsoft Global Catalog over SSL (similar to port 3268, LDAP over SSL)"
3283,"Net Assistant, a predecessor to Apple Remote Desktop"
3283,Apple Remote Desktop 2.0 or later
3290,Virtual Air Traffic Simulation (VATSIM) network voice communication
3305,Odette File Transfer Protocol (OFTP)
3306,MySQL database system
3313,Verisys file integrity monitoring software
3316,AzimuthVMS database port for the CCTV recording software AzimuthVMS
3323,DECE GEODI Server
3332,Thundercloud DataPath Overlay Control
3333,"Eggdrop, an IRC bot default port"
3333,Network Caller ID server
3333,CruiseControl.rb
3351,Pervasive PSQL
3386,GTP' 3GPP GSM/UMTS CDR logging protocol
3389,Microsoft Terminal Server (RDP) officially registered as Windows Based Terminal (WBT)
3396,Novell NDPS Printer Agent
3412,xmlBlaster
3455,Resource Reservation Protocol (RSVP)
3423,Xware xTrm Communication Protocol
3424,Xware xTrm Communication Protocol over SSL
3478,"STUN, a protocol for NAT traversal"
3478,"TURN, a protocol for NAT traversal (extension to STUN)"
3478,STUN Behavior Discovery. See also port 5349.
3479,PlayStation Network
3480,PlayStation Network
3483,Slim Devices discovery protocol
3483,Slim Devices SlimProto protocol
3493,Network UPS Tools (NUT)
3516,Smartcard Port
3527,Microsoft Message Queuing
3535,SMTP alternate
3544,Teredo tunneling
3632,"Distcc, distributed compiler"
3645,Cyc
3659,"Apple SASL, used by Mac OS X Server Password Server"
3659,Battlefield 4
3667,Information Exchange
3689,"Digital Audio Access Protocol (DAAP), used by Apple's iTunes and AirPlay"
3690,Subversion (SVN) version control system
3702,"Web Services Dynamic Discovery (WS-Discovery), used by various components of Windows Vista and later"
3724,Some Blizzard games
3724,Club Penguin Disney online game for kids
3725,Netia NA-ER Port
3768,RBLcheckd server daemon
3784,Bidirectional Forwarding Detection (BFD)for IPv4 and IPv6 (Single Hop) (RFC 5881)
3785,VoIP program used by Ventrilo
3799,RADIUS change of authorization
3804,Harman Professional HiQnet protocol
3825,RedSeal Networks client/server connection
3826,WarMUX game server
3826,RedSeal Networks client/server connection
3835,RedSeal Networks client/server connection
3830,"System Management Agent, developed and used by Cerner to monitor and manage solutions"
3856,ERP Server Application used by F10 Software
3880,IGRS
3868,Diameter base protocol (RFC 3588)
3872,Oracle Enterprise Manager Remote Agent
3900,"udt_os, IBM UniData UDT OS"
3960,Warframe online interaction
3962,Warframe online interaction
3978,OpenTTD game (masterserver and content service)
3979,OpenTTD game
3999,Norman distributed scanning service
4000,Diablo II game
4001,Microsoft Ants game
4001,CoreOS etcd client communication
4018,Protocol information and warnings
4035,IBM Rational Developer for System z Remote System Explorer Daemon
4045,Solaris lockd NFS lock daemon/manager
