Port,Description
13000-13050,"Second Life, used for server UDP in-bound"
13008,"CrossFire, a multiplayer online First Person Shooter"
13075,"Default for BMC Software Control-M/Enterprise Manager Corba communication, though often changed during installation"
13720,Symantec NetBackup-bprd (formerly VERITAS)
13721,Symantec NetBackup-bpdbm (formerly VERITAS)
13724,Symantec Network Utility-vnetd (formerly VERITAS)
13782,Symantec NetBackup-bpcd (formerly VERITAS)
13783,Symantec VOPIED protocol (formerly VERITAS)
13785,Symantec NetBackup Database-nbdb (formerly VERITAS)
13786,Symantec nomdb (formerly VERITAS)
14550,MAVLink Ground Station Port
14567,Battlefield 1942 and mods
15000,psyBNC
15000,Wesnoth
15000,Kaspersky Network Agent
15441,ZeroNet fileserver
15567,Battlefield Vietnam and mods
15345,XPilot Contact
15672,RabbitMQ management plugin
16000,Oracle WebCenter Content: Imaging (formerly known as Oracle Universal Content Management). Port though often changed during installation
16000,shroudBNC
16080,Mac OS X Server Web (HTTP) service with performance cache
16200,Oracle WebCenter Content: Content Server (formerly known as Oracle Universal Content Management). Port though often changed during installation
16225,Oracle WebCenter Content: Content Server Web UI. Port though often changed during installation
16250,Oracle WebCenter Content: Inbound Refinery (formerly known as Oracle Universal Content Management). Port though often changed during installation
16261,Project Zomboid multiplayer. Additional sequential ports used for each player connecting to server.
16300,Oracle WebCenter Content: Records Management (formerly known as Oracle Universal Records Management). Port though often changed during installation
16384,CISCO Default RTP MIN
16384-16403,"Real-time Transport Protocol (RTP), RTP Control Protocol (RTCP), used by Apple's iChat for audio and video"
16384-16387,"Real-time Transport Protocol (RTP), RTP Control Protocol (RTCP), used by Apple's FaceTime and Game Center"
16393-16402,"Real-time Transport Protocol (RTP), RTP Control Protocol (RTCP), used by Apple's FaceTime and Game Center"
16403-16472,"Real-time Transport Protocol (RTP), RTP Control Protocol (RTCP), used by Apple's Game Center"
16400,Oracle WebCenter Content: Capture (formerly known as Oracle Document Capture). Port though often changed during installation
16482,CISCO Default RTP MAX
16567,Battlefield 2 and mods
17011,Worms multiplayer
17500,Dropbox LanSync Protocol (db-lsp); used to synchronize file catalogs between Dropbox clients on a local network.
18091,memcached Internal REST HTTPS for SSL
18092,memcached Internal CAPI HTTPS for SSL
18104,RAD PDF Service
18200,"Audition Online Dance Battle, AsiaSoft Thailand Server status/version check"
18201,"Audition Online Dance Battle, AsiaSoft Thailand Server"
18206,"Audition Online Dance Battle, AsiaSoft Thailand Server FAM database"
18300,"Audition Online Dance Battle, AsiaSoft SEA Server status/version check"
18301,"Audition Online Dance Battle, AsiaSoft SEA Server"
18306,"Audition Online Dance Battle, AsiaSoft SEA Server FAM database"
18333,Bitcoin testnet
18400,"Audition Online Dance Battle, KAIZEN Brazil Server status/version check"
18401,"Audition Online Dance Battle, KAIZEN Brazil Server"
18505,"Audition Online Dance Battle R4p3 Server, Nexon Server status/version check"
18506,"Audition Online Dance Battle, Nexon Server"
18605,X-BEAT status/version check
18606,X-BEAT
19000,"Audition Online Dance Battle, G10/alaplaya Server status/version check"
19000,JACK sound server
19001,"Audition Online Dance Battle, G10/alaplaya Server"
19132,Minecraft: Pocket Edition multiplayer server
19150,Gkrellm Server
19226,Panda Software AdminSecure Communication Agent
19294,Google Talk Voice and Video connections
19295,Google Talk Voice and Video connections
19302,Google Talk Voice and Video connections
19812,4D database SQL Communication
19813,4D database Client Server Communication
19814,4D database DB4D Communication
19999,"Distributed Network Protocol-Secure (DNP-Secure), a secure version of the protocol used in SCADA systems between communicating RTU's and IED's"
20000,"Distributed Network Protocol (DNP), a protocol used in SCADA systems between communicating RTU's and IED's"
20000,"Usermin, Web-based Unix/Linux user administration tool (default port)"
20000,Used on VoIP networks for receiving and transmitting voice telephony traffic which includes Google Voice via the OBiTalk ATA devices as well as on the MagicJack and Vonage ATA network devices.
20560,Killing Floor
20595,0 A.D. Empires Ascendant
20808,Ableton Link
21025,"Starbound Server (default), Starbound"
22000,Syncthing (default)
22136,FLIR Systems Camera Resource Protocol
22222,"Davis Instruments, WeatherLink IP"
23073,Soldat Dedicated Server
23399,Skype default protocol
23513,Duke Nukem 3D source ports
24441,Pyzor spam detection network
24444,NetBeans integrated development environment
24465,Tonido Directory Server for Tonido which is a Personal Web App and P2P platform
24554,"BINKP, Fidonet mail transfers over TCP/IP"
24800,Synergy: keyboard/mouse sharing software
24842,StepMania: Online: Dance Dance Revolution Simulator
25565,Minecraft multiplayer server
25565,Minecraft multiplayer server query
25575,Minecraft multiplayer server RCON
25826,collectd default port
26000,id Software's Quake server
26000,EVE Online
26000,"Xonotic, an open source arena shooter"
26900-26901,EVE Online
27000,PowerBuilder SySAM license server
27000-27006,id Software's QuakeWorld master server
27000-27009,FlexNet Publisher's License server (from the range of default ports)
27000-27015,Steam (game client traffic)
27015,GoldSrc and Source engine dedicated server port
27015-27018,"Unturned, a survival game"
27015-27030,Steam (matchmaking and HLTV)
27015-27030,Steam (downloads)
27016,Magicka server port
27017,MongoDB daemon process (mongod) and routing service (mongos)
27031,Steam (In-Home Streaming)
27036,Steam (In-Home Streaming)
27037,Steam (In-Home Streaming)
27374,Sub7 default.
27500-27900,id Software's QuakeWorld
27888,Kaillera server
27901-27910,id Software's Quake II master server
27950,OpenArena outgoing
27960-27969,"Activision's Enemy Territory and id Software's Quake III Arena, Quake III and Quake Live and some ioquake3 derived games, such as Urban Terror (OpenArena incoming)"
28001,Starsiege: Tribes
28015,Rust (video game)
28770-28771,"AssaultCube Reloaded, a video game based upon a modification of AssaultCube"
28785-28786,Cube 2: Sauerbraten
28852,Killing Floor
28910,Nintendo Wi-Fi Connection
28960,Call of Duty; Call of Duty: United Offensive; Call of Duty 2; Call of Duty 4: Modern Warfare; Call of Duty: World at War (PC platform)
29000,"Perfect World, an adventure and fantasy MMORPG"
29070,Jedi Knight: Jedi Academy by Ravensoft
29900-29901,Nintendo Wi-Fi Connection
29920,Nintendo Wi-Fi Connection
30564,Multiplicity: keyboard/mouse/clipboard sharing software
31337,Back Orifice and  Back Orifice 2000 remote administration tools
31416,BOINC RPC
31438,Rocket U2
31457,TetriNET
32137,"Immunet Protect (UDP in version 2.0, TCP since version 3.0)"
32400,Plex Media Server
32764,"A backdoor found on certain Linksys, Netgear and other wireless DSL modems/combination routers"
32887,"Ace of Spades, a multiplayer FPS video game"
32976,"LogMeIn Hamachi, a VPN application; also TCP port 12975 and SSL (TCP 443)."
33434,traceroute
33848,"Jenkins, a continuous integration (CI) tool"
34000,"Infestation: Survivor Stories (formerly known as The War Z), a multiplayer zombie video game"
34197,"Factorio, a multiplayer survival and factory-building game"
35357,OpenStack Identity (Keystone) administration
37008,TZSP intrusion detection
40000,SafetyNET p - a real-time Industrial Ethernet protocol
43110,ZeroNet web UI default port
43594-43595,RuneScape
44405,Mu Online Connect Server
44818,EtherNet/IP explicit messaging
47001,Windows Remote Management Service (WinRM)
47808,BACnet Building Automation and Control Networks (4780810 = BAC016)
49151,Reserved
49152-65535,Certificate Management over CMS
60000-61000,Range from which Mosh - a remote-terminal application similar to SSH - typically assigns ports for ongoing sessions between Mosh servers and Mosh clients.
64738,Mumble
