Port,Description
4050,Mud Master Chat protocol (MMCP) - Peer-to-peer communications between MUD clients.
4069,Minger Email Address Verification Protocol
4089,OpenCORE Remote Control Service
4090,Kerio
4093,PxPlus Client server interface ProvideX
4096,Ascom Timeplex Bridge Relay Element (BRE)
4105,Shofar (ShofarNexus)
4111,Xgrid
4116,Smartcard-TLS
4125,Microsoft Remote Web Workplace administration
4172,Teradici PCoIP
4190,ManageSieve
4198,Couch Potato Android app
4201,TinyMUD and various derivatives
4222,NATS server default port
4226,"Aleph One, a computer game"
4242,Orthanc - DICOM server
4242,Quassel distributed IRC client
4243,"Docker implementations, redistributions, and setups default"
4243,CrashPlan
4244,Viber
4303,Simple Railroad Command Protocol (SRCP)
4307,TrueConf Client - TrueConf Server media data exchange
4321,Referral Whois (RWhois) Protocol
4352,"PJLink, by JBMIA for controlling projectors via LAN connections"
4444,Oracle WebCenter Content: Content Server-Intradoc Socket port. (formerly known as Oracle Universal Content Management).
4444,Metasploit's default listener port
4444,Xvfb X server virtual frame buffer service
4444-4445,I2P HTTP/S proxy
4486,Integrated Client Message Service (ICMS)
4488,"Apple Wide Area Connectivity Service, used by Back to My Mac"
4500,"IPSec NAT Traversal (RFC 3947, RFC 4306)"
4502-4534,Microsoft Silverlight connectable ports under non-elevated trust
4505-4506,Salt master
4534,Armagetron Advanced server default
4560,default Log4j socketappender port
4567,Sinatra default server port in development mode (HTTP)
4569,Inter-Asterisk eXchange (IAX2)
4604,Identity Registration Protocol
4605,Direct End to End Secure Chat Protocol
4610-4640,QualiSystems TestShell Suite Services
4662,OrbitNet Message Service
4662,Default for older versions of eMule
4664,Google Desktop Search
4672,Default for older versions of eMule
4711,eMule optional web interface
4713,PulseAudio sound server
4728,Computer Associates Desktop and Server Management (DMP)/Port Multiplexer
4730,Gearman's job server
4739,IP Flow Information Export
4747,Apprentice
4750,BladeLogic Agent
4753,SIMON (service and discovery)
4789,Virtual eXtensible Local Area Network (VXLAN)
4840,OPC UA Connection Protocol (TCP) and OPC UA Multicast Datagram Protocol (UDP) for OPC Unified Architecture from OPC Foundation
4843,OPC UA TCP Protocol over TLS/SSL for OPC Unified Architecture from OPC Foundation
4847,"Web Fresh Communication, Quadrion Software & Odorless Entertainment"
4848,"Java, Glassfish Application Server administration default"
4894,LysKOM Protocol A
4949,Munin Resource Monitoring Tool
4950,Cylon Controls UC32 Communications Port
5000,UPnP-Windows network device interoperability
5000,"VTun, VPN Software"
5000,FlightGear multiplayer
5000,"Synology Inc. Management Console, File Station, Audio Station"
5000,Flask Development Webserver
5000,Heroku console access
5000,"AT&T U-verse public, educational, and government access (PEG) streaming over HTTP"
5000-5500,"League of Legends, a multiplayer online battle arena video game"
5001,Slingbox and Slingplayer
5001,Iperf (Tool for measuring TCP and UDP bandwidth performance)
5001,"Synology Inc. Secured Management Console, File Station, Audio Station"
5002,ASSA ARX access control system
5003,FileMaker - name binding and transport
5004,"Real-time Transport Protocol media data (RTP) (RFC 3551, RFC 4571)"
5005,"Real-time Transport Protocol control protocol (RTCP) (RFC 3551, RFC 4571)"
5010,Registered to: TelePath (the IBM FlowMark workflow-management system messaging platform)The TCP port is now used for: IBM WebSphere MQ Workflow
5011,TelePath (the IBM FlowMark workflow-management system messaging platform)
5025,scpi-raw Standard Commands for Programmable Instruments
5031,AVM CAPI-over-TCP (ISDN over Ethernet tunneling)
5037,Android ADB server
5048,Texai Message Service
5050,Yahoo! Messenger
5051,ita-agent Symantec Intruder Alert
5060,Session Initiation Protocol (SIP)
5061,Session Initiation Protocol (SIP) over TLS
5062,Localisation access
5064,EPICS Channel Access server
5065,EPICS Channel Access repeater beacon
5070,Binary Floor Control Protocol (BFCP)
5084,EPCglobal Low Level Reader Protocol (LLRP)
5085,EPCglobal Low Level Reader Protocol (LLRP) over TLS
5093,"SafeNet, Inc Sentinel LM, Sentinel RMS, License Manager, client-to-server"
5099,"SafeNet, Inc Sentinel LM, Sentinel RMS, License Manager, server-to-server"
5104,IBM Tivoli Framework NetCOOL/Impact HTTP Service
5121,Neverwinter Nights
5124,TorgaNET (Micronational Darknet)
5125,TorgaNET (Micronational Intelligence Darknet)
5150,ATMP Ascend Tunnel Management Protocol
5151,ESRI SDE Instance
5151,ESRI SDE Remote Start
5154,BZFlag
5172,PC over IP Endpoint Management
5190,AOL Instant Messenger protocol. The chat app is defunct as of  15 December 2017.
5198,EchoLink VoIP Amateur Radio Software (Voice)
5199,EchoLink VoIP Amateur Radio Software (Voice)
5200,EchoLink VoIP Amateur Radio Software (Information)
5201,Iperf3 (Tool for measuring TCP and UDP bandwidth performance)
5222,Extensible Messaging and Presence Protocol (XMPP) client connection
5223,Apple Push Notification Service
5223,Extensible Messaging and Presence Protocol (XMPP) client connection over SSL
5228,HP Virtual Room Service
5228,"Google Play, Android Cloud to Device Messaging Service, Google Cloud Messaging"
5242,Viber
5243,Viber
5246,Control And Provisioning of Wireless Access Points (CAPWAP) CAPWAP control
5247,Control And Provisioning of Wireless Access Points (CAPWAP) CAPWAP data
5269,Extensible Messaging and Presence Protocol (XMPP) server-to-server connection
5280,Extensible Messaging and Presence Protocol (XMPP)
5281,Extensible Messaging and Presence Protocol (XMPP)
5298,Extensible Messaging and Presence Protocol (XMPP)
5310,"Outlaws, a 1997 first-person shooter video game"
5318,Certificate Management over CMS
5349,"STUN over TLS/DTLS, a protocol for NAT traversal"
5349,"TURN over TLS/DTLS, a protocol for NAT traversal"
5349,STUN Behavior Discovery over TLS. See also port 3478.
5351,NAT Port Mapping Protocol and Port Control Protocol-client-requested configuration for connections through network address translators and firewalls
5353,Multicast DNS (mDNS)
5355,"Link-Local Multicast Name Resolution (LLMNR), allows hosts to perform name resolution for hosts on the same local link (only provided by Windows Vista and Server 2008)"
5357,"Web Services for Devices (WSDAPI) (only provided by Windows Vista, Windows 7 and Server 2008)"
5358,"WSDAPI Applications to Use a Secure Channel (only provided by Windows Vista, Windows 7 and Server 2008)"
5394,"Kega Fusion, a Sega multi-console emulator"
5402,Multicast File Transfer Protocol (MFTP)
5405,NetSupport Manager
5412,IBM Rational Synergy (Telelogic Synergy) (Continuus CM) Message Router
5413,Wonderware SuiteLink service
5417,SNS Agent
5421,NetSupport Manager
5432,PostgreSQL database system
5433,Bouwsoft file/webserver
5445,Cisco Unified Video Advantage
5480,VMware VAMI (Virtual Appliance Management Infrastructure)-used for initial setup of various administration settings on Virtual Appliances designed using the VAMI architecture.
5481,Schneider Electric's ClearSCADA (SCADA implementation for Windows) - used for client-to-server communication.
5495,IBM Cognos TM1 Admin server
5498,Hotline tracker server connection
5499,Hotline tracker server discovery
5500,Hotline control connection
5500,VNC Remote Frame Buffer RFB protocol-for incoming listening viewer
5501,Hotline file transfer connection
5517,Setiqueue Proxy server client for SETI@Home project
5550,Hewlett-Packard Data Protector
5554,Fastboot default wireless port
5555,Oracle WebCenter Content: Inbound Refinery-Intradoc Socket port. (formerly known as Oracle Universal Content Management). Port though often changed during installation
5555,"Freeciv versions up to 2.0, Hewlett-Packard Data Protector, McAfee EndPoint Encryption Database Server, SAP, Default for Microsoft Dynamics CRM 4.0, Softether VPN default port"
5556,"Freeciv, Oracle WebLogic Server Node Manager"
5568,"Session Data Transport (SDT), a part of Architecture for Control Networks (ACN)"
5601,Kibana
5631,"pcANYWHEREdata, Symantec pcAnywhere (version 7.52 and later) data"
5632,"pcANYWHEREstat, Symantec pcAnywhere (version 7.52 and later) status"
5656,IBM Lotus Sametime p2p file transfer
5666,NRPE (Nagios)
5667,NSCA (Nagios)
5670,FILEMQ ZeroMQ File Message Queuing Protocol
5670,ZRE-DISC ZeroMQ Realtime Exchange Protocol (Discovery)
5671,Advanced Message Queuing Protocol (AMQP) over TLS
5672,Advanced Message Queuing Protocol (AMQP)
5678,Mikrotik RouterOS Neighbor Discovery Protocol (MNDP)
5683,Constrained Application Protocol (CoAP)
5701,Hazelcast default communication port
5722,"Microsoft RPC, DFSR (SYSVOL) Replication Service"
5718,Microsoft DPM Data Channel (with the agent coordinator)
5719,Microsoft DPM Data Channel (with the protection agent)
5723,System Center Operations Manager
5724,Operations Manager Console
5741,IDA Discover Port 1
5742,IDA Discover Port 2
5800,VNC Remote Frame Buffer RFB protocol over HTTP
5800,ProjectWise Server
5900,Remote Frame Buffer protocol (RFB)
5900,Virtual Network Computing (VNC) Remote Frame Buffer RFB protocol
5931,AMMYY admin Remote Control
5938,TeamViewer remote desktop protocol
5984,CouchDB database server
5985,Windows PowerShell Default psSession Port
5986,Windows PowerShell Default psSession Port
5988-5989,CIM-XML (DMTF Protocol)
6000-6063,X11-used between an X client and server over the network
6005,Default for BMC Software Control-M/Server-Socket used for communication between Control-M processes-though often changed during installation
6005,Default for Camfrog chat & cam client
6009,JD Edwards EnterpriseOne ERP system JDENet messaging client listener
6050,Arcserve backup
6051,Arcserve backup
6086,"Peer Distributed Transfer Protocol (PDTP), FTP like file server in a P2P network"
6100,Vizrt System
6100,Ventrilo authentication for version 3
6101,Backup Exec Agent Browser
6110,"softcm, HP Softbench CM"
6111,"spc, HP Softbench Sub-Process Control"
6112,"dtspcd, execute commands and launch applications remotely"
6112,"Blizzard's Battle.net gaming service and some games, ArenaNet gaming service, Relic gaming service"
6112,Club Penguin Disney online game for kids
6113,"Club Penguin Disney online game for kids, Used by some Blizzard games"
6136,ObjectDB database server
6159,ARINC 840 EFB Application Control Interface
6200,Oracle WebCenter Content Portable: Content Server (With Native UI) and Inbound Refinery
6201,Oracle WebCenter Content Portable: Admin
6225,Oracle WebCenter Content Portable: Content Server Web UI
6227,Oracle WebCenter Content Portable: JavaDB
6240,Oracle WebCenter Content Portable: Capture
6244,Oracle WebCenter Content Portable: Content Server-Intradoc Socket port
6255,Oracle WebCenter Content Portable: Inbound Refinery-Intradoc Socket port
6257,WinMX (see also 6699)
6260,planet M.U.L.E.
6262,Sybase Advantage Database Server
6343,"SFlow, sFlow traffic monitoring"
6346,"gnutella-svc, gnutella (FrostWire, Limewire, Shareaza, etc.)"
6347,"gnutella-rtr, Gnutella alternate"
6350,App Discovery and Access Protocol
6379,Redis key-value data store
6389,EMC CLARiiON
6432,PgBouncer-A connection pooler for PostgreSQL
6436,Leap Motion Websocket Server TLS
6437,Leap Motion Websocket Server
6444,Sun Grid Engine Qmaster Service
6445,Sun Grid Engine Execution Service
6463-6472,Discord RPC
6464,Port assignment for medical device communication in accordance to IEEE 11073-20701
6502,Netop Remote Control
6513,NETCONF over TLS
6514,Syslog over TLS
6515,Elipse RPC Protocol (REC)
6543,Pylons project#Pyramid Default Pylons Pyramid web service port
6556,Check MK Agent
6566,SANE (Scanner Access Now Easy)-SANE network scanner daemon
6560-6561,Speech-Dispatcher daemon
6571,Windows Live FolderShare client
6600,Microsoft Hyper-V Live
6600,Music Player Daemon (MPD)
6601,Microsoft Forefront Threat Management Gateway
6602,Microsoft Windows WSS Communication
6619,"odette-ftps, Odette File Transfer Protocol (OFTP) over TLS/SSL"
6622,Multicast FTP
6653,OpenFlow
6660-6664,Internet Relay Chat (IRC)
6665-6669,Internet Relay Chat (IRC)
6679,Osorno Automation Protocol (OSAUT)
6679,IRC SSL (Secure Internet Relay Chat)-often used
6690,Synology Cloud station
6697,IRC SSL (Secure Internet Relay Chat)-often used
6699,WinMX (see also 6257)
6715,AberMUD and derivatives default port
6771,BitTorrent Local Peer Discovery
6783-6785,Splashtop Remote server broadcast
6789,Campbell Scientific Loggernet Software
6789,Bucky's Instant Messaging Program
6869,Derandom default server
6881-6887,BitTorrent part of full range of ports used most often
6888,MUSE
6888,BitTorrent part of full range of ports used most often
6889-6890,BitTorrent part of full range of ports used most often
6891-6900,BitTorrent part of full range of ports used most often
6891-6900,Windows Live Messenger (File transfer)
6901,Windows Live Messenger (Voice)
6901,BitTorrent part of full range of ports used most often
6902-6968,BitTorrent part of full range of ports used most often
6969,acmsoda
6969,BitTorrent tracker
6970-6999,BitTorrent part of full range of ports used most often
6970-6999,QuickTime Streaming Server
7000,Default for Vuze's built-in HTTPS Bittorrent Tracker
7000,Avira Server Management Console
7001,Avira Server Management Console
7001,"Default for BEA WebLogic Server's HTTP server, though often changed during installation"
7002,"Default for BEA WebLogic Server's HTTPS server, though often changed during installation"
7005,"Default for BMC Software Control-M/Server and Control-M/Agent for Agent-to-Server, though often changed during installation"
7006,"Default for BMC Software Control-M/Server and Control-M/Agent for Server-to-Agent, though often changed during installation"
7010,Default for Cisco AON AMC (AON Management Console)
7022,Database mirroring endpoints
7023,Bryan Wilcutt T2-NMCS Protocol for SatCom Modems
7025,Zimbra LMTP -local mail delivery
7047,Zimbra conversion server
7070,"Real Time Streaming Protocol (RTSP), used by QuickTime Streaming Server. TCP is used by default, UDP is used as an alternate."
7133,Enemy Territory: Quake Wars
7144,Peercast
7145,Peercast
7171,Tibia
7262,CNAP (Calypso Network Access Protocol)
7272,WatchMe - WatchMe Monitoring
7306,Zimbra mysql 
7307,Zimbra mysql 
7312,Sibelius License Server
7396,Web control interface for Folding@home v7.3.6 and later
7400,RTPS (Real Time Publish Subscribe) DDS Discovery
7401,RTPS (Real Time Publish Subscribe) DDS User-Traffic
7402,RTPS (Real Time Publish Subscribe) DDS Meta-Traffic
7471,Stateless Transport Tunneling (STT)
7473,Rise: The Vieneo Province
7474,Neo4J Server webadmin
7478,Default port used by Open iT Server.
7542,Saratoga file transfer protocol
7547,CPE WAN Management Protocol (CWMP) Technical Report 069
7575,Populous: The Beginning server
7624,Instrument Neutral Distributed Interface
7631,ERLPhase
7634,hddtemp-Utility to monitor hard drive temperature
7652-7654,I2P anonymizing overlay network
7655,I2P SAM Bridge Socket API
7656-7660,I2P anonymizing overlay network
7670,BrettspielWelt BSW Boardgame Portal
7687,Bolt database connection
7707-7708,Killing Floor
7717,Killing Floor
7777,iChat server file transfer proxy
7777,Oracle Cluster File System 2
7777,Windows backdoor program tini.exe default
7777,Just Cause 2: Multiplayer Mod Server
7777,Terraria default server
7777,San Andreas Multiplayer (SA-MP) default port server
7777-7788,Unreal Tournament series default server
7831,Default used by Smartlaunch Internet Cafe Administration software
7880,PowerSchool Gradebook Server
7890,Default that will be used by the iControl Internet Cafe Suite Administration software
7915,Default for YSFlight server
7935,"Fixed port used for Adobe Flash Debug Player to communicate with a debugger (Flash IDE, Flex Builder or fdb)."
7946,Docker Swarm communication among nodes
7990,Atlassian Bitbucket (default port)
8000,"Commonly used for Internet radio streams such as SHOUTcast, Icecast and iTunes Radio"
8000,DynamoDB Local
8000,Django Development Webserver
8005,Tomcat remote shutdown
8006,Quest AppAssure 5 API
8007,Quest AppAssure 5 Engine
8008,Alternative port for HTTP. See also ports 80 and 8080.
8008,IBM HTTP Server administration default
8008,"iCal, a calendar application by Apple"
8009,Apache JServ Protocol (ajp13)
8042,Orthanc - REST API over HTTP
8069,OpenERP 5.0 XML-RPC protocol
8070,OpenERP 5.0 NET-RPC protocol
8074,Gadu-Gadu
8075,Killing Floor web administration interface
8080,Alternative port for HTTP. See also ports 80 and 8008.
8080,Apache Tomcat
8080,Atlassian JIRA applications
8088,Asterisk management access via HTTP
8089,Splunk daemon management
8089,Fritz!Box automatic TR-069 configuration
8090,Atlassian Confluence
8090,Coral Content Distribution Network (legacy; 80 and 8080 now supported)
8091,CouchBase web administration
8092,CouchBase API
8111,JOSM Remote Control
8112,PAC Pacifica Coin
8116,Check Point Cluster Control Protocol
8118,Privoxy-advertisement-filtering Web proxy
8123,Polipo Web proxy
8139,Puppet (software) Client agent
8140,Puppet (software) Master server
8172,Microsoft Remote Administration for IIS Manager
8184,NCSA Brown Dog Data Access Proxy
8194-8195,Bloomberg Terminal
8200,GoToMyPC
8200,MiniDLNA media server Web Interface
8222,VMware VI Web Access via HTTP
8243,HTTPS listener for Apache Synapse
8245,Dynamic DNS for at least No-IP and DyDNS
8280,HTTP listener for Apache Synapse
8281,HTTP Listener for Gatecraft Plugin
8291,Winbox-Default on a MikroTik RouterOS for a Windows application used to administer MikroTik RouterOS
8303,Teeworlds Server
8332,Bitcoin JSON-RPC server
8333,Bitcoin
8333,VMware VI Web Access via HTTPS
8337,VisualSVN Distributed File System Service (VDFS)
8384,Syncthing web GUI
8388,Shadowsocks proxy server
8443,SW Soft Plesk Control Panel
8443,Apache Tomcat SSL
8443,Promise WebPAM SSL
8443,iCal over SSL
8444,Bitmessage
8484,MapleStory Login Server
8500,Adobe ColdFusion built-in web server
8530,Windows Server Update Services over HTTP
8531,Windows Server Update Services over HTTPS
8580,"Freegate, an Internet anonymizer and proxy tool"
8629,Tibero database
8642,Lotus Notes Traveler auto synchronization for Windows Mobile and Nokia devices
8691,"Ultra Fractal, a fractal generation and rendering software application - distributed calculations over networked computers"
8767,"Voice channel of TeamSpeak 2, a proprietary Voice over IP protocol targeted at gamers"
8834,"Nessus, a vulnerability scanner - remote XML-RPC web server"
8840,"Opera Unite, an extensible framework for web applications"
8880,"Alternate port of CDDB (Compact Disc Database) protocol, used to look up audio CD (compact disc) information over the Internet. See also port 888."
8880,IBM WebSphere Application Server SOAP connector
8883,Secure MQTT (MQTT over TLS)
8887,HyperVM over HTTP
8888,HyperVM over HTTPS
8888,Freenet web UI (localhost only)
8888,Default for IPython / Jupyter notebook dashboards
8888,MAMP
8889,MAMP
8983,Apache Solr
8997,Alternate port for I2P Monotone Proxy
8998,I2P Monotone Proxy
8999,Alternate port for I2P Monotone Proxy
9000,SonarQube Web Server
9000,DBGp
9000,SqueezeCenter web server & streaming
9000,UDPCast
9000,Play! Framework web server
9000,Hadoop NameNode default port
9000,PHP-FPM default port
9000,QBittorrent's embedded torrent tracker default port
9001,ETL Service Manager
9001,Microsoft SharePoint authoring environment
9001,cisco-xremote router configuration
9001,Tor network default
9001,DBGp Proxy
9001,HSQLDB default port
9002,Newforma Server comms
9006,De-Commissioned Port
9006,Tomcat in standalone mode
9030,Tor often used
9042,Apache Cassandra native protocol clients
9043,WebSphere Application Server Administration Console secure
9050-9051,Tor
9060,WebSphere Application Server Administration Console
9080,"glrpc, Groove Collaboration software GLRPC"
9080,WebSphere Application Server HTTP Transport (port 1) default
9080,"Remote Potato by FatAttitude, Windows Media Center addon"
9080,"ServerWMC, Windows Media Center addon"
9090,Openfire Administration Console
9090,SqueezeCenter control (CLI)
9090,Cherokee Admin Panel
9091,Openfire Administration Console (SSL Secured)
9091,Transmission (BitTorrent client) Web Interface
9092,H2 (DBMS) Database Server
9092,Apache Kafka A Distributed Streaming Platform
9100,"PDL Data Stream, used for printing to certain network printers"
9101,Bacula Director
9102,Bacula File Daemon
9103,Bacula Storage Daemon
9119,MXit Instant Messenger
9150,Tor
9191,Sierra Wireless Airlink
9199,Avtex LLC-qStats
9200,Elasticsearch-default Elasticsearch port
9217,iPass Platform Service
9293,Sony PlayStation RemotePlay
9300,IBM Cognos BI
9303,D-Link Shareport Share storage and MFP printers
9306,Sphinx Native API
9309,Sony PlayStation Vita Host Collaboration WiFi Data Transfer
9312,Sphinx SphinxQL
9332,Litecoin JSON-RPC server
9333,Litecoin
9339,"Clash of Clans, a mobile freemium strategy video game"
9389,"adws, Microsoft AD DS Web Services, Powershell uses this port"
9418,"git, Git pack transfer service"
9419,MooseFS distributed file system - master control port
9420,MooseFS distributed file system - master command port
9421,MooseFS distributed file system - master client port
9422,MooseFS distributed file system - Chunkservers
9425,MooseFS distributed file system - CGI server
9443,VMware Websense Triton console (HTTPS port used for accessing and administrating a vCenter Server via the Web Management Interface)
9443,NCSA Brown Dog Data Tilling Service
9535,"mngsuite, LANDesk Management Suite Remote Control"
9536,"laes-bf, IP Fabrics Surveillance buffering function"
9600,"Factory Interface Network Service (FINS), a network protocol used by Omron programmable logic controllers"
9675,"Spiceworks Desktop, IT Helpdesk Software"
9676,"Spiceworks Desktop, IT Helpdesk Software"
9695,"Content centric networking (CCN, CCNx)"
9785,Viber
9800,WebDAV Source
9800,WebCT e-learning portal
9875,Club Penguin Disney online game for kids
9898,Tripwire-File Integrity Monitoring Software
9899,"SCTP tunneling (port number used in SCTP packets encapsulated in UDP, RFC 6951)"
9981,TVHeadend HTTP server (web interface)
9982,TVHeadend HTSP server (Streaming protocol)
9987,TeamSpeak 3 server default (voice) port (for the conflicting service see the IANA list)
9993,ZeroTier Default port for ZeroTier
9997,Splunk port for communication between the forwarders and indexers
9999,Urchin Web Analytics
10000,Network Data Management Protocol
10000,BackupExec
10000,"Webmin, Web-based Unix/Linux system administration tool (default port)"
10000-20000,Used on VoIP networks for receiving and transmitting voice telephony traffic which includes Google Voice via the OBiTalk ATA devices as well as on the MagicJack and Vonage ATA network devices.
10001,Ubiquiti UniFi access points broadcast to 255.255.255.255:10001 (UDP) to locate the controller(s)
10009,"CrossFire, a multiplayer online First Person Shooter"
10010,Open Object Rexx (ooRexx) rxapi daemon
10024,Zimbra smtp -to amavis from postfix
10025,Zimbra smtp -back to postfix from amavis
10042,Mathoid server
10050,Zabbix agent
10051,Zabbix trapper
10080,"Touhou fight games (Immaterial and Missing Power, Scarlet Weather Rhapsody, Hisoutensoku, Hopeless Masquerade and Urban Legend in Limbo)"
10110,NMEA 0183 Navigational Data. Transport of NMEA 0183 sentences over TCP or UDP
10172,Intuit Quickbooks client
10200,FRISK Software International's fpscand virus scanning daemon for Unix platforms
10200,FRISK Software International's f-protd virus scanning daemon for Unix platforms
10201-10204,FRISK Software International's f-protd virus scanning daemon for Unix platforms
10212,GE Intelligent Platforms Proficy HMI/SCADA - CIMPLICITY WebView
10308,Lock On: Modern Air Combat
10480,SWAT 4 Dedicated Server
10505,BlueStacks (android simulator) broadcast
10514,TLS-enabled Rsyslog (default by convention)
10823,Farming Simulator 2011
10891,Jungle Disk (this port is opened by the Jungle Disk Monitor service on the localhost)
10933,Listen port used by the Octopus Deploy Tentacle deployment agent
11001,metasys ( Johnson Controls Metasys java AC control environment )
11111,"RiCcI, Remote Configuration Interface (Redhat Linux)"
11112,ACR/NEMA Digital Imaging and Communications in Medicine (DICOM)
11211,memcached
11214,memcached incoming SSL proxy
11215,memcached internal outgoing SSL proxy
11235,Savage: Battle for Newerth
11311,Robot Operating System master
11371,OpenPGP HTTP key server
11753,OpenRCT2 multiplayer
12012,"Audition Online Dance Battle, Korea Server-Status/Version Check"
12013,"Audition Online Dance Battle, Korea Server"
12035,"Second Life, used for server UDP in-bound"
12043,"Second Life, used for LSL HTTPS in-bound"
12046,"Second Life, used for LSL HTTP in-bound"
12201,Graylog Extended Log Format (GELF)
12222,Light Weight Access Point Protocol (LWAPP) LWAPP data (RFC 5412)
12223,Light Weight Access Point Protocol (LWAPP) LWAPP control (RFC 5412)
12345,Cube World
12345,Little Fighter 2
12345,NetBus remote administration tool (often Trojan horse).
12443,IBM HMC web browser management access over HTTPS instead of default port 443
12489,NSClient/NSClient++/NC_Net (Nagios)
12975,LogMeIn Hamachi (VPN tunnel software; also port 32976)-used to connect to Mediation Server (bibi.hamachi.cc); will attempt to use SSL (TCP port 443) if both 12975 & 32976 fail to connect
